{"data_cutoff":"2026-10-07T00:05:28Z","dataset_sha256":"958cdbda3c831df6b756c8a19772f0139e34014a68244ca707ce823fbca2f03c","evaluation_note":"The current public data head is a431af719b869ae578b95e1392df8618cee0dfc8. The Muka Kampung observed temperature correction was stored at 2026-10-07T00:05:28Z (08:05 WITA), after the first target window began at 08:00 WITA. No corrected-head target PCI output was replayed or published. The previously available target snapshot predated the correction but was collected after the prior-day 20:00 WITA operational cutoff, so it cannot be presented as an official D+1 forecast. Corrected-data operational forward evaluation abstained on all 24 test observations; MAE is null. Retrospective forward used later backfilled environmental inputs, and LODO can train on future dates. Neither establishes D+1 skill.","metrics":{"backfill_forward_coverage":0.125,"backfill_forward_mae":0.06713106485259779,"backfill_forward_predicted":3,"backfill_forward_test":24,"backfill_global_baseline_mae":0.040000000000000015,"backfill_site_baseline_mae":0.05833333333333333,"lodo_coverage":0.875,"lodo_global_baseline_mae":0.07523809523809524,"lodo_mae":0.0681590241681593,"lodo_predicted":21,"lodo_site_baseline_mae":0.06857142857142857,"lodo_test":24,"observation_days":9,"observations":24,"operational_forward_abstention":24,"operational_forward_coverage":0,"operational_forward_mae":null,"operational_forward_predicted":0,"operational_forward_test":24,"site_records_alung_banua":3,"site_records_bunaken_timur_one":0,"site_records_bunaken_timur_two":0,"site_records_celah_celah":4,"site_records_fukui":3,"site_records_johnsons_wall":0,"site_records_lekuan_one":0,"site_records_lekuan_three":2,"site_records_lekuan_two":4,"site_records_mandolin":2,"site_records_mikes_point":0,"site_records_muka_kampung":3,"site_records_pahepa":1,"site_records_pangalisang":0,"site_records_raymonds_point":0,"site_records_rons_point":1,"site_records_sachikos_point":1,"site_records_tanjung_parigi":0,"site_records_tengah":0,"total_sites":19},"model_version":"weighted-analog-v1.3","operational_forecast":false,"schema_version":"1.0","version":"1.0.1"}
